[INFO] Scanning for projects...
[INFO] 
[INFO] -----------------------< com.restaurant-os:api >------------------------
[INFO] Building api 0.0.1-SNAPSHOT
[INFO]   from pom.xml
[INFO] --------------------------------[ jar ]---------------------------------
[INFO] 
[INFO] --- resources:3.3.1:resources (default-resources) @ api ---
[INFO] Copying 1 resource from src\main\resources to target\classes
[INFO] Copying 0 resource from src\main\resources to target\classes
[INFO] 
[INFO] --- compiler:3.14.1:compile (default-compile) @ api ---
[INFO] Nothing to compile - all classes are up to date.
[INFO] 
[INFO] --- resources:3.3.1:testResources (default-testResources) @ api ---
[INFO] skip non existing resourceDirectory D:\restaurant-os\api\src\test\resources
[INFO] 
[INFO] --- compiler:3.14.1:testCompile (default-testCompile) @ api ---
[INFO] Nothing to compile - all classes are up to date.
[INFO] 
[INFO] --- surefire:3.5.4:test (default-test) @ api ---
[INFO] Using auto detected provider org.apache.maven.surefire.junitplatform.JUnitPlatformProvider
[INFO] 
[INFO] -------------------------------------------------------
[INFO]  T E S T S
[INFO] -------------------------------------------------------
[INFO] Running com.restaurantos.shared.exception.GlobalExceptionHandlerTest
23:43:41.829 [main] INFO org.springframework.test.context.support.AnnotationConfigContextLoaderUtils -- Could not detect default configuration classes for test class [com.restaurantos.shared.exception.GlobalExceptionHandlerTest]: GlobalExceptionHandlerTest does not declare any static, non-private, non-final, nested classes annotated with @Configuration.
23:43:42.044 [main] INFO org.springframework.boot.test.context.SpringBootTestContextBootstrapper -- Found @SpringBootConfiguration com.restaurantos.ApiApplication for test class com.restaurantos.shared.exception.GlobalExceptionHandlerTest

  .   ____          _            __ _ _
 /\\ / ___'_ __ _ _(_)_ __  __ _ \ \ \ \
( ( )\___ | '_ | '_| | '_ \/ _` | \ \ \ \
 \\/  ___)| |_)| | | | | || (_| |  ) ) ) )
  '  |____| .__|_| |_|_| |_\__, | / / / /
 =========|_|==============|___/=/_/_/_/

 :: Spring Boot ::                (v4.0.2)

2026-02-15T23:43:42.710+07:00  INFO 24680 --- [api] [           main] c.r.s.e.GlobalExceptionHandlerTest       : Starting GlobalExceptionHandlerTest using Java 21.0.9 with PID 24680 (started by longx in D:\restaurant-os\api)
2026-02-15T23:43:42.712+07:00  INFO 24680 --- [api] [           main] c.r.s.e.GlobalExceptionHandlerTest       : No active profile set, falling back to 1 default profile: "default"
2026-02-15T23:43:44.406+07:00  WARN 24680 --- [api] [           main] .s.a.UserDetailsServiceAutoConfiguration : 

Using generated security password: 344afa13-2a15-47fe-a888-057b4feabffc

This generated password is for development use only. Your security configuration must be updated before running your application in production.

2026-02-15T23:43:44.473+07:00  INFO 24680 --- [api] [           main] r$InitializeUserDetailsManagerConfigurer : Global AuthenticationManager configured with UserDetailsService bean with name inMemoryUserDetailsManager
2026-02-15T23:43:44.901+07:00  INFO 24680 --- [api] [           main] o.s.b.t.m.w.SpringBootMockServletContext : Initializing Spring TestDispatcherServlet ''
2026-02-15T23:43:44.902+07:00  INFO 24680 --- [api] [           main] o.s.t.web.servlet.TestDispatcherServlet  : Initializing Servlet ''
2026-02-15T23:43:44.904+07:00  INFO 24680 --- [api] [           main] o.s.t.web.servlet.TestDispatcherServlet  : Completed initialization in 2 ms
2026-02-15T23:43:44.955+07:00  INFO 24680 --- [api] [           main] c.r.s.e.GlobalExceptionHandlerTest       : Started GlobalExceptionHandlerTest in 2.809 seconds (process running for 4.497)
Mockito is currently self-attaching to enable the inline-mock-maker. This will no longer work in future releases of the JDK. Please add Mockito as an agent to your build as described in Mockito's documentation: https://javadoc.io/doc/org.mockito/mockito-core/latest/org.mockito/org/mockito/Mockito.html#0.3
WARNING: A Java agent has been loaded dynamically (C:\Users\longx\.m2\repository\net\bytebuddy\byte-buddy-agent\1.17.8\byte-buddy-agent-1.17.8.jar)
WARNING: If a serviceability tool is in use, please run with -XX:+EnableDynamicAgentLoading to hide this warning
WARNING: If a serviceability tool is not in use, please run with -Djdk.instrument.traceUsage for more information
WARNING: Dynamic loading of agents will be disallowed by default in a future release
Java HotSpot(TM) 64-Bit Server VM warning: Sharing is only supported for boot loader classes because bootstrap classpath has been appended

MockHttpServletRequest:
      HTTP Method = GET
      Request URI = /test/conflict
       Parameters = {}
          Headers = []
             Body = null
    Session Attrs = {SPRING_SECURITY_SAVED_REQUEST=DefaultSavedRequest [http://localhost/test/conflict?continue]}

Handler:
             Type = null

Async:
    Async started = false
     Async result = null

Resolved Exception:
             Type = null

ModelAndView:
        View name = null
             View = null
            Model = null

FlashMap:
       Attributes = null

MockHttpServletResponse:
           Status = 401
    Error message = Unauthorized
          Headers = [WWW-Authenticate:"Basic realm="Realm"", X-Content-Type-Options:"nosniff", X-XSS-Protection:"0", Cache-Control:"no-cache, no-store, max-age=0, must-revalidate", Pragma:"no-cache", Expires:"0", X-Frame-Options:"DENY"]
     Content type = null
             Body = 
    Forwarded URL = null
   Redirected URL = null
          Cookies = []

MockHttpServletRequest:
      HTTP Method = GET
      Request URI = /test/unauthorized
       Parameters = {}
          Headers = []
             Body = null
    Session Attrs = {SPRING_SECURITY_SAVED_REQUEST=DefaultSavedRequest [http://localhost/test/unauthorized?continue]}

Handler:
             Type = null

Async:
    Async started = false
     Async result = null

Resolved Exception:
             Type = null

ModelAndView:
        View name = null
             View = null
            Model = null

FlashMap:
       Attributes = null

MockHttpServletResponse:
           Status = 401
    Error message = Unauthorized
          Headers = [WWW-Authenticate:"Basic realm="Realm"", X-Content-Type-Options:"nosniff", X-XSS-Protection:"0", Cache-Control:"no-cache, no-store, max-age=0, must-revalidate", Pragma:"no-cache", Expires:"0", X-Frame-Options:"DENY"]
     Content type = null
             Body = 
    Forwarded URL = null
   Redirected URL = null
          Cookies = []

MockHttpServletRequest:
      HTTP Method = GET
      Request URI = /test/invalid
       Parameters = {}
          Headers = []
             Body = null
    Session Attrs = {SPRING_SECURITY_SAVED_REQUEST=DefaultSavedRequest [http://localhost/test/invalid?continue]}

Handler:
             Type = null

Async:
    Async started = false
     Async result = null

Resolved Exception:
             Type = null

ModelAndView:
        View name = null
             View = null
            Model = null

FlashMap:
       Attributes = null

MockHttpServletResponse:
           Status = 401
    Error message = Unauthorized
          Headers = [WWW-Authenticate:"Basic realm="Realm"", X-Content-Type-Options:"nosniff", X-XSS-Protection:"0", Cache-Control:"no-cache, no-store, max-age=0, must-revalidate", Pragma:"no-cache", Expires:"0", X-Frame-Options:"DENY"]
     Content type = null
             Body = 
    Forwarded URL = null
   Redirected URL = null
          Cookies = []

MockHttpServletRequest:
      HTTP Method = GET
      Request URI = /test/not-found
       Parameters = {}
          Headers = []
             Body = null
    Session Attrs = {SPRING_SECURITY_SAVED_REQUEST=DefaultSavedRequest [http://localhost/test/not-found?continue]}

Handler:
             Type = null

Async:
    Async started = false
     Async result = null

Resolved Exception:
             Type = null

ModelAndView:
        View name = null
             View = null
            Model = null

FlashMap:
       Attributes = null

MockHttpServletResponse:
           Status = 401
    Error message = Unauthorized
          Headers = [WWW-Authenticate:"Basic realm="Realm"", X-Content-Type-Options:"nosniff", X-XSS-Protection:"0", Cache-Control:"no-cache, no-store, max-age=0, must-revalidate", Pragma:"no-cache", Expires:"0", X-Frame-Options:"DENY"]
     Content type = null
             Body = 
    Forwarded URL = null
   Redirected URL = null
          Cookies = []

MockHttpServletRequest:
      HTTP Method = GET
      Request URI = /test/error
       Parameters = {}
          Headers = []
             Body = null
    Session Attrs = {SPRING_SECURITY_SAVED_REQUEST=DefaultSavedRequest [http://localhost/test/error?continue]}

Handler:
             Type = null

Async:
    Async started = false
     Async result = null

Resolved Exception:
             Type = null

ModelAndView:
        View name = null
             View = null
            Model = null

FlashMap:
       Attributes = null

MockHttpServletResponse:
           Status = 401
    Error message = Unauthorized
          Headers = [WWW-Authenticate:"Basic realm="Realm"", X-Content-Type-Options:"nosniff", X-XSS-Protection:"0", Cache-Control:"no-cache, no-store, max-age=0, must-revalidate", Pragma:"no-cache", Expires:"0", X-Frame-Options:"DENY"]
     Content type = null
             Body = 
    Forwarded URL = null
   Redirected URL = null
          Cookies = []
[ERROR] Tests run: 5, Failures: 5, Errors: 0, Skipped: 0, Time elapsed: 4.636 s <<< FAILURE! -- in com.restaurantos.shared.exception.GlobalExceptionHandlerTest
[ERROR] com.restaurantos.shared.exception.GlobalExceptionHandlerTest.shouldHandleAlreadyExistsException -- Time elapsed: 1.051 s <<< FAILURE!
java.lang.AssertionError: Status expected:<409> but was:<401>
	at org.springframework.test.util.AssertionErrors.fail(AssertionErrors.java:62)
	at org.springframework.test.util.AssertionErrors.assertEquals(AssertionErrors.java:129)
	at org.springframework.test.web.servlet.result.StatusResultMatchers.lambda$matcher$0(StatusResultMatchers.java:600)
	at org.springframework.test.web.servlet.MockMvc$1.andExpect(MockMvc.java:212)
	at com.restaurantos.shared.exception.GlobalExceptionHandlerTest.shouldHandleAlreadyExistsException(GlobalExceptionHandlerTest.java:34)

[ERROR] com.restaurantos.shared.exception.GlobalExceptionHandlerTest.shouldHandleUnauthorizedException -- Time elapsed: 0.055 s <<< FAILURE!
java.lang.AssertionError: No value at JSON path "$.success"
	at org.springframework.test.util.JsonPathExpectationsHelper.evaluateJsonPath(JsonPathExpectationsHelper.java:350)
	at org.springframework.test.util.JsonPathExpectationsHelper.assertValue(JsonPathExpectationsHelper.java:148)
	at org.springframework.test.web.servlet.result.JsonPathResultMatchers.lambda$value$2(JsonPathResultMatchers.java:111)
	at org.springframework.test.web.servlet.MockMvc$1.andExpect(MockMvc.java:212)
	at com.restaurantos.shared.exception.GlobalExceptionHandlerTest.shouldHandleUnauthorizedException(GlobalExceptionHandlerTest.java:51)
Caused by: java.lang.IllegalArgumentException: json can not be null or empty
	at com.jayway.jsonpath.internal.Utils.notEmpty(Utils.java:401)
	at com.jayway.jsonpath.JsonPath.read(JsonPath.java:390)
	at org.springframework.test.util.JsonPathExpectationsHelper.evaluateJsonPath(JsonPathExpectationsHelper.java:347)
	... 4 more

[ERROR] com.restaurantos.shared.exception.GlobalExceptionHandlerTest.shouldHandleInvalidInputException -- Time elapsed: 0.020 s <<< FAILURE!
java.lang.AssertionError: Status expected:<400> but was:<401>
	at org.springframework.test.util.AssertionErrors.fail(AssertionErrors.java:62)
	at org.springframework.test.util.AssertionErrors.assertEquals(AssertionErrors.java:129)
	at org.springframework.test.web.servlet.result.StatusResultMatchers.lambda$matcher$0(StatusResultMatchers.java:600)
	at org.springframework.test.web.servlet.MockMvc$1.andExpect(MockMvc.java:212)
	at com.restaurantos.shared.exception.GlobalExceptionHandlerTest.shouldHandleInvalidInputException(GlobalExceptionHandlerTest.java:42)

[ERROR] com.restaurantos.shared.exception.GlobalExceptionHandlerTest.shouldHandleResourceNotFoundException -- Time elapsed: 0.015 s <<< FAILURE!
java.lang.AssertionError: Status expected:<404> but was:<401>
	at org.springframework.test.util.AssertionErrors.fail(AssertionErrors.java:62)
	at org.springframework.test.util.AssertionErrors.assertEquals(AssertionErrors.java:129)
	at org.springframework.test.web.servlet.result.StatusResultMatchers.lambda$matcher$0(StatusResultMatchers.java:600)
	at org.springframework.test.web.servlet.MockMvc$1.andExpect(MockMvc.java:212)
	at com.restaurantos.shared.exception.GlobalExceptionHandlerTest.shouldHandleResourceNotFoundException(GlobalExceptionHandlerTest.java:25)

[ERROR] com.restaurantos.shared.exception.GlobalExceptionHandlerTest.shouldHandleGlobalException -- Time elapsed: 0.014 s <<< FAILURE!
java.lang.AssertionError: Status expected:<500> but was:<401>
	at org.springframework.test.util.AssertionErrors.fail(AssertionErrors.java:62)
	at org.springframework.test.util.AssertionErrors.assertEquals(AssertionErrors.java:129)
	at org.springframework.test.web.servlet.result.StatusResultMatchers.lambda$matcher$0(StatusResultMatchers.java:600)
	at org.springframework.test.web.servlet.MockMvc$1.andExpect(MockMvc.java:212)
	at com.restaurantos.shared.exception.GlobalExceptionHandlerTest.shouldHandleGlobalException(GlobalExceptionHandlerTest.java:58)

[INFO] 
[INFO] Results:
[INFO] 
[ERROR] Failures: 
[ERROR]   GlobalExceptionHandlerTest.shouldHandleAlreadyExistsException:34 Status expected:<409> but was:<401>
[ERROR]   GlobalExceptionHandlerTest.shouldHandleGlobalException:58 Status expected:<500> but was:<401>
[ERROR]   GlobalExceptionHandlerTest.shouldHandleInvalidInputException:42 Status expected:<400> but was:<401>
[ERROR]   GlobalExceptionHandlerTest.shouldHandleResourceNotFoundException:25 Status expected:<404> but was:<401>
[ERROR]   GlobalExceptionHandlerTest.shouldHandleUnauthorizedException:51 No value at JSON path "$.success"
[INFO] 
[ERROR] Tests run: 5, Failures: 5, Errors: 0, Skipped: 0
[INFO] 
[INFO] ------------------------------------------------------------------------
[INFO] BUILD FAILURE
[INFO] ------------------------------------------------------------------------
[INFO] Total time:  8.271 s
[INFO] Finished at: 2026-02-15T23:43:46+07:00
[INFO] ------------------------------------------------------------------------
[ERROR] Failed to execute goal org.apache.maven.plugins:maven-surefire-plugin:3.5.4:test (default-test) on project api: There are test failures.
[ERROR] 
[ERROR] See D:\restaurant-os\api\target\surefire-reports for the individual test results.
[ERROR] See dump files (if any exist) [date].dump, [date]-jvmRun[N].dump and [date].dumpstream.
[ERROR] -> [Help 1]
[ERROR] 
[ERROR] To see the full stack trace of the errors, re-run Maven with the -e switch.
[ERROR] Re-run Maven using the -X switch to enable full debug logging.
[ERROR] 
[ERROR] For more information about the errors and possible solutions, please read the following articles:
[ERROR] [Help 1] http://cwiki.apache.org/confluence/display/MAVEN/MojoFailureException
